{
  "$schema": "https://json-schema.org/draft/2020-12/schema",
  "title": "PacketSpec",
  "description": "Transport boundary; semantic nested and evidence checks require rfqfuzz.v1.contracts.",
  "type": "object",
  "required": [
    "schema_version",
    "case_id",
    "part_id",
    "family",
    "units",
    "release_association",
    "authority",
    "manufacturing",
    "setup",
    "profile",
    "features",
    "requirements",
    "obligations",
    "artifacts",
    "render"
  ],
  "additionalProperties": false,
  "properties": {
    "schema_version": {
      "const": "1.0"
    },
    "case_id": {},
    "part_id": {},
    "family": {},
    "units": {},
    "release_association": {},
    "authority": {},
    "manufacturing": {},
    "setup": {},
    "profile": {},
    "features": {},
    "requirements": {},
    "obligations": {},
    "artifacts": {},
    "render": {}
  }
}
